created_at,text,clean-text,location,place
Sat Nov 13 12:17:43 +0000 2021,b'Damn \xf0\x9f\x98\xa2 #COVID19 @tnatw https://t.co/URQD1dcoEE',damn,#RemoteWork #Boston ,"Nashua, NH"
Sat Nov 13 12:23:38 +0000 2021,"b'#COVID19 Faridabad, Haryana, IN Update:\n\nTotal Cases - 99915\nNew Cases Today - 3\nCases Discharged/Recovered Today -\xe2\x80\xa6 https://t.co/kCoWDbvSNl'",faridabad haryana in update total cases 99915 new cases today 3 cases discharged recovered today,"फरीदाबाद, भारत","Faridabad, India"
Sat Nov 13 12:26:51 +0000 2021,b'700+ cases today? https://t.co/5nI0qcAd4Y',700 cases today,"Colombo, Sri Lanka",Sri Lanka
Sat Nov 13 12:25:36 +0000 2021,"b'@jamesp1987 @mattletiss7 Hope your son gets well soon, but he has coronavirus not covid. The test is for the virus, not the disease.'",hope your son gets well soon but he has coronavirus not covid the test is for the virus not the disease,Sheffield ,"Sheffield, England"
Sat Nov 13 12:26:01 +0000 2021,b'Seth McFarlane for life https://t.co/YtuIrZeAHG',seth mcfarlane for life,,"Bristol, RI"
Sat Nov 13 12:25:34 +0000 2021,b'Unvaccinated persons comprise the majority of COVID-19 during Delta surge.\n\xc2\xa0\nBreakthrough COVID-19 occurred among v\xe2\x80\xa6 https://t.co/f5ByjteGOv',unvaccinated persons comprise the majority of covid 19 during delta surge breakthrough covid 19 occurred among v,"Rochester, MN, United States",Mayo Clinic
Sat Nov 13 12:28:38 +0000 2021,b'Lordy. https://t.co/FaX6xuejmN',lordy,"Portland, Oregon","Washington, USA"
Sat Nov 13 12:29:21 +0000 2021,"b'Yesterday, I hosted Her Excellency VP @jessica_alupo as I shared with her and our good Minister @JaneRuth_Aceng wha\xe2\x80\xa6 https://t.co/s94VKzFzkP'",yesterday i hosted her excellency vp as i shared with her and our good minister wha,Uganda,"Kampala, Uganda"
Sat Nov 13 12:28:58 +0000 2021,b'Super Video https://t.co/iJJ6tAFNT8',super video,,"Oberhausen, Deutschland"
Sat Nov 13 12:27:45 +0000 2021,b'About the benefits of getting vaccinated https://t.co/Yg0E3BMPKU',about the benefits of getting vaccinated,"Porto, Portugal","Celorico de Basto, Portugal"
Sat Nov 13 12:37:17 +0000 2021,b'YHA is also out in Ekhuruleni this #VoomaVaccinationWeekend supporting the initiative to bring vaccines to communit\xe2\x80\xa6 https://t.co/0sb03ME3lM',yha is also out in ekhuruleni this supporting the initiative to bring vaccines to communit,South Africa,"Dukathole, South Africa"
Sat Nov 13 12:38:10 +0000 2021,"b""Yes! We'll done...\n#Nbpoli \n@premierbhiggs\n@Jan70534353 https://t.co/NgaEQaFCmE""",yes well done,Canada,"Devon 30, New Brunswick"
Sat Nov 13 12:36:36 +0000 2021,b'CEC @tashi_gyalson reviews #COVID19 situation in #Leh.\n\nDistrict Administration to impose strict #CovidProtocols to\xe2\x80\xa6 https://t.co/tpjlmf7WUN',cec reviews situation in district administration to impose strict to,Leh,"Leh, Union Territory of Ladakh, India"
Sat Nov 13 12:36:21 +0000 2021,b'Expensive divorce prompts re-examination of personal morality? https://t.co/h7h9LrRykp',expensive divorce prompts re examination of personal morality,"Oxford, Oxfordshire","Oxford, England"
Sat Nov 13 12:40:55 +0000 2021,b'So are we admitting now the vaccines arnt great or wats the crack?\n#COVID19',so are we admitting now the vaccines arnt great or wats the crack,Dublin,"Kildare, Ireland"
Sat Nov 13 12:47:16 +0000 2021,"b'James C. Smith, a Pfizer Board Member, was President, Chief Executive Officer (CEO) and Director of Thomson Reuters\xe2\x80\xa6 https://t.co/tgkoijPyAS'",james c smith a pfizer board member was president chief executive officer ceo and director of thomson reuters,"Stoughton, MA","Stoughton, MA"
Sat Nov 13 12:47:09 +0000 2021,b'Never ceases to amaze me that the doctors with the most bizarre and incorrect views on COVID-19 vaccines and COVID-\xe2\x80\xa6 https://t.co/STKG8zpaQm',never ceases to amaze me that the doctors with the most bizarre and incorrect views on covid 19 vaccines and covid,,"Baltimore, MD"
Sat Nov 13 12:46:30 +0000 2021,b'PLUG &amp; PLAY \xf0\x9f\x8e\xa7 Underground DJ/KJ \xf0\x9f\x95\x8a\xf0\x9f\x94\xa5\xf0\x9f\xa5\xb7\xf0\x9f\x8f\xbc https://t.co/6Yl5G4JHxk ALL DAY EVERY DAY \xf0\x9f\x92\x9b ALL NIGHT EVERY NIGHT \xf0\x9f\x96\xa4 How have y\xe2\x80\xa6 https://t.co/enIKwKMI8A',plug amp play underground dj kj all day every day all night every night how have y,,"Austin, TX"
Sat Nov 13 12:48:16 +0000 2021,b'The cost of #COVID19 treatment for one day. Please get #vaccinated https://t.co/gN6JIyFzFX',the cost of treatment for one day please get,United Kingdom,"Glasgow, Scotland"
Sat Nov 13 12:47:51 +0000 2021,b'Unvaccinated persons comprise the majority of COVID-19 during Delta surge.\n\nRecommendation:\nGet the covid-19 vaccine!',unvaccinated persons comprise the majority of covid 19 during delta surge recommendation get the covid 19 vaccine,"Rochester, MN, United States",Mayo Clinic
Sat Nov 13 12:47:51 +0000 2021,"b""@capseyes_cappy @MollyJongFast Am I getting false info? You can still catch and spread COVID-19 even if you're vaccinated? Right?""",am i getting false info you can still catch and spread covid 19 even if youre vaccinated right,,"Newton, NC"
Sat Nov 13 12:48:31 +0000 2021,b'Breakthrough COVID-19 occurred among vaccinated persons with high-risk medical comorbidities.\n\nRecommendation:\nMask\xe2\x80\xa6 https://t.co/xRPHNSXou2',breakthrough covid 19 occurred among vaccinated persons with high risk medical comorbidities recommendation mask,"Rochester, MN, United States",Mayo Clinic
Sat Nov 13 12:47:47 +0000 2021,b'Russia reports record daily COVID-19 deaths https://t.co/nYZGUSf2Pb',russia reports record daily covid 19 deaths,"Story County, Iowa","Ames, IA"
Sat Nov 13 12:49:04 +0000 2021,b'#COVID19 #boosterdose done!\nThanks to @OttawaHospital for making this available to us at work! https://t.co/jp9Ko96zyu',done thanks to for making this available to us at work,"Ottawa, Ontario",Ottawa Hospital - Civic Campus
Sat Nov 13 12:49:00 +0000 2021,b'See this!!? https://t.co/MksGswdAQx',see this,"Wisconsin, USA","Wausau, WI"
Sat Nov 13 12:47:59 +0000 2021,b'@pfizer If they are authorized to prevent COVID-19 then they have failed miserably.  There are now more vaxxed peop\xe2\x80\xa6 https://t.co/loItY7VCFG',if they are authorized to prevent covid 19 then they have failed miserably there are now more vaxxed peop,"South Lanarkshire, U.K.","Coalburn, Scotland"
Sat Nov 13 12:49:51 +0000 2021,"b'Starting today, @BrdgstoneArena will no longer require proof of COVID-19 vaccination or a negative test at\xe2\x80\xa6 https://t.co/BfuIzOFkJg'",starting today will no longer require proof of covid 19 vaccination or a negative test at,"Nashville, TN",Bridgestone Arena
Sat Nov 13 12:51:10 +0000 2021,"b'the test. Negative. Vaccines and masks work. They work. The person I was in contact with is doing fine, I\xe2\x80\x99m glad to\xe2\x80\xa6 https://t.co/WSxM4lh2xV'",the test negative vaccines and masks work they work the person i was in contact with is doing fine i m glad to,,"St Louis, MO"
Sat Nov 13 12:49:53 +0000 2021,b'Casirivimab-imdevimab\xc2\xa0was associated with lower rates of hospitalization.\n\nRecommendation:\nIf with COVID-19 symptom\xe2\x80\xa6 https://t.co/IYeXdWrEGp',casirivimab imdevimab was associated with lower rates of hospitalization recommendation if with covid 19 symptom,"Rochester, MN, United States",Mayo Clinic
Sat Nov 13 12:49:58 +0000 2021,"b'This country\xe2\x80\x99s approach to covid is more than a bit mad. I\xe2\x80\x99m in a queue awaiting a booster shot, some here for thei\xe2\x80\xa6 https://t.co/erWCjXGwCG'",this country s approach to covid is more than a bit mad i m in a queue awaiting a booster shot some here for thei,"Hackney, London","Hackney, London"
Sat Nov 13 12:53:25 +0000 2021,"b""Flights/Passengers movement at #AAI's #BhavnagarAirport as on 12.11.2021\nNo. of ARR Flights: 03\nNo. of DEP Flights:\xe2\x80\xa6 https://t.co/WVbgARf3RY""",flights passengers movement at as on 12 11 2021 no of arr flights 03 no of dep flights,"Bhavnagar, India","Bhavnagar, India"
Sat Nov 13 12:53:52 +0000 2021,b'The new Covid-19 legal case that South African workers should know about https://t.co/TN1cwvqY6M via @businesstechSA',the new covid 19 legal case that south african workers should know about via,,"Randburg, South Africa"
Sat Nov 13 12:56:30 +0000 2021,b'#trumpkilledpeopleintentionally  just like #Regan #Aids both are responsible for deaths due to #politicalpoints bot\xe2\x80\xa6 https://t.co/t338gt0eAM',just like both are responsible for deaths due to bot,,"New Orleans, LA"
Sat Nov 13 12:55:45 +0000 2021,b'Non anti-vaxxers\xe2\x80\xa6 please update your cvs\xf0\x9f\xa4\xad\xf0\x9f\xa4\xad https://t.co/SFg8lTBG7P',non anti vaxxers please update your cvs,"Pretoria, South Africa","Pretoria, South Africa"
Sat Nov 13 12:54:56 +0000 2021,b'Any chance of asking them to compensate us for unleashing COVID-19 on the World while your at it? https://t.co/WfKuKIZcdQ',any chance of asking them to compensate us for unleashing covid 19 on the world while your at it,"Llanfair Pwllgwyngyll, Wales","Llanfair Pwllgwyngyll, Wales"
Sat Nov 13 12:54:59 +0000 2021,b'Y\xe2\x80\x99all saying only 6 like 1 isn\xe2\x80\x99t too many https://t.co/ScGJivnDJ3',y all saying only 6 like 1 isn t too many,In ya nigga DMs goin bonkers ,"Paterson, NJ"
Sat Nov 13 12:56:38 +0000 2021,b'Excellent thread on where #Covid May go next. #COVID19 https://t.co/5AaB0pWiHG',excellent thread on where may go next,United Kingdom,"Glasgow, Scotland"
Sat Nov 13 12:59:04 +0000 2021,"b'So after a week of thinking I had a very bad cold, I suddenly got a cough and lost my sense of taste and smell. Too\xe2\x80\xa6 https://t.co/AcPVYqb5Bu'",so after a week of thinking i had a very bad cold i suddenly got a cough and lost my sense of taste and smell too,"South East, England","South East, England"
Sat Nov 13 12:58:24 +0000 2021,b'.@DSMpartnership &amp; @MadisonCountyIA hosted @SenJoniErnst for tour of Angel Wings &amp; CT &amp; #smallbusiness roundtable d\xe2\x80\xa6 https://t.co/3rZJD9ng2v',amp hosted for tour of angel wings amp ct amp roundtable d,"Des Moines, Iowa  USA","Winterset, IA"
Sat Nov 13 12:57:35 +0000 2021,"b""Away from my anger at the lack of arrests of the clique of thieves, I'll cease fire and retweet this very important\xe2\x80\xa6 https://t.co/VgYQTZrPMJ""",away from my anger at the lack of arrests of the clique of thieves ill cease fire and retweet this very important,"Lusaka, Zambia.","Lusaka, Zambia"
Sat Nov 13 12:58:32 +0000 2021,b'The problem with withdrawn studies like this is that the people who believe what they heard never learn the truth.\xe2\x80\xa6 https://t.co/1HbdYOEvbl',the problem with withdrawn studies like this is that the people who believe what they heard never learn the truth,OnMyGrandchildren's🌏planet ,"Durham, NC"
Sat Nov 13 12:59:47 +0000 2021,"b'Always late to the party, today I tested positive for #COVID19. This is not over.\n\nHelp slow the spread and identif\xe2\x80\xa6 https://t.co/3RiUQUTHkf'",always late to the party today i tested positive for this is not over help slow the spread and identif,Warrenpoint / Islington,"Islington, London"
Sat Nov 13 12:59:35 +0000 2021,b'@NewsHourExtra @PeterHotez @NewsHour @saribethrose @sharemylesson @LostToCovid @CovidEducators @CCOR_C19Monitor\xe2\x80\xa6 https://t.co/lGSYO3tNis',,Lodi CA USA,"Lodi, CA"
Sat Nov 13 13:00:00 +0000 2021,b'\xf0\x9f\x93\x8c\xf0\x9f\x97\xa3 Louder Please!! https://t.co/jcNvjcaLLx',louder please,"Mafikeng, South Africa","Mafikeng, South Africa"
Sat Nov 13 13:02:14 +0000 2021,b'Grateful to finally get the COVID-19 booster  #vaccinated #levelup https://t.co/8PENSOxDAB',grateful to finally get the covid 19 booster,"London, England",Citywest Vaccination Centre (CVC)
Sat Nov 13 13:02:25 +0000 2021,b'This video is well done. https://t.co/jNg2fqO3ja',this video is well done,"Maryville, TN","Maryville, TN"
Sat Nov 13 13:04:59 +0000 2021,b'Last night was rough. The side effects of the #ModernaBooster hit me about 1 and stuck with me all night. Aches chi\xe2\x80\xa6 https://t.co/0FdBd3DMN0',last night was rough the side effects of the hit me about 1 and stuck with me all night aches chi,"Madison, WI","Wisconsin, USA"
Sat Nov 13 13:09:36 +0000 2021,b'OSHA guidelines regarding COVID19',osha guidelines regarding covid19,,"Philadelphia, PA"
Sat Nov 13 13:11:07 +0000 2021,"b""Okay, Virginia &amp; Maryland aren't playing games! But gonna need DC to start doing better. \xf0\x9f\x99\x84 #COVID19 #vaccination https://t.co/16GeHXizrC""",okay virginia amp maryland arent playing games but gonna need dc to start doing better,"Washington, DC","Washington, DC"
Sat Nov 13 13:11:49 +0000 2021,b'@JoanneSoave I\xe2\x80\x99d rather have a brain tickle than give a plane full of people #COVID19 &amp; I\xe2\x80\x99ll tell ya that for free!\xe2\x80\xa6 https://t.co/sy752drl8X',i d rather have a brain tickle than give a plane full of people amp i ll tell ya that for free,"Windsor/Waterloo, Ontario","Windsor, Ontario"
Sat Nov 13 13:13:18 +0000 2021,b'Great stuff. https://t.co/s3IYZNTlR0',great stuff,"Chicago, IL","Northfield, IL"
Sat Nov 13 13:14:41 +0000 2021,"b'""Here are the most common side effects for kids after each dose of Pfizer\'s COVID-19 vaccine""  https://t.co/1iHCkCEtri'",here are the most common side effects for kids after each dose of pfizers covid 19 vaccine,The Jersey Cape ,"Manhattan, NY"
Sat Nov 13 13:14:17 +0000 2021,b'Today\xe2\x80\x99s walk-up vaccination &amp; testing sites.\n\nPediatric vaccine supply is limited but is expected to increase in th\xe2\x80\xa6 https://t.co/DVsY0BmyrT',today s walk up vaccination amp testing sites pediatric vaccine supply is limited but is expected to increase in th,"Washington, DC","Washington, DC"
Sat Nov 13 13:14:48 +0000 2021,"b'""Here are the most common side effects for kids after each dose of Pfizer\'s COVID-19 vaccine""  https://t.co/VD6coeZUe2'",here are the most common side effects for kids after each dose of pfizers covid 19 vaccine,The Jersey Cape,"Manhattan, NY"
Sat Nov 13 13:18:03 +0000 2021,"b'Coronavirus: 4,642 new cases confirmed in Ireland https://t.co/L0PrjREdtP'",coronavirus 4 642 new cases confirmed in ireland,"Galway, Ireland","Galway, Ireland"
Sat Nov 13 13:19:40 +0000 2021,b'So proud of @EthiopianNomad for her latest OpEd about #vaccine \xe2\x80\x9csurvivor\xe2\x80\x99s guilt\xe2\x80\x9d for the African diaspora. Her yea\xe2\x80\xa6 https://t.co/ibdYFnlxAr',so proud of for her latest oped about survivor s guilt for the african diaspora her yea,"Washington, DC","Washington, DC"
Sat Nov 13 13:18:21 +0000 2021,b'#Boosted #Pfizervaccine Feeling Grateful to @WexGenHosp @HSELive had my booster vaccine today; 20 months on and sti\xe2\x80\xa6 https://t.co/RmP0jdRfDZ',feeling grateful to had my booster vaccine today 20 months on and sti,Ireland,"Wexford, Ireland"
Sat Nov 13 13:20:57 +0000 2021,"b'Quebec:\n\n A preview of what happened in long-term care facilities. This summer, I interviewed many healthcare worke\xe2\x80\xa6 https://t.co/4Lgm7QrphV'",quebec a preview of what happened in long term care facilities this summer i interviewed many healthcare worke,"Québec, Canada","Québec, Canada"
Sat Nov 13 13:21:32 +0000 2021,"b'Covid-19 Skeptics, Publisher Sue Sen. Elizabeth Warren https://t.co/pOZvVmuoXR via @publisherswkly'",covid 19 skeptics publisher sue sen elizabeth warren via,"Detroit, MI","River Forest, IL"
Sat Nov 13 13:20:12 +0000 2021,b'Truth in back and white... https://t.co/03MzdAwNpv',truth in back and white,,"Monterrey, Nuevo León"
Sat Nov 13 13:20:20 +0000 2021,b'@DillonMThomas @GovofCO @jaredpolis @CBSDenver And I\xe2\x80\x99ll likely survive easily again.  With the #COVID19 #vaccine there\xe2\x80\x99s a chance I won\xe2\x80\x99t.',and i ll likely survive easily again with the there s a chance i won t,Chiefland FL,"Florida, USA"
Sat Nov 13 13:22:19 +0000 2021,"b'Dr. Gary H. Gibbons, Director @nih_nhlbi kicks off #AHA21 @AHAMeetings with a lecture on how concerted scientific e\xe2\x80\xa6 https://t.co/8FXpCk6k3E'",dr gary h gibbons director kicks off with a lecture on how concerted scientific e,"Tulsa, OK","Tulsa, OK"
Sat Nov 13 13:22:50 +0000 2021,b'The vaccinated are doing a fine job of spreading #Covid19 https://t.co/KCkIvmHKtQ',the vaccinated are doing a fine job of spreading,Below George Carlin,"Burlington, Ontario"
Sat Nov 13 13:23:42 +0000 2021,b'Works so well you need a bonus booster maybe 2. Nice animation though https://t.co/Yc8T5gG80j',works so well you need a bonus booster maybe 2 nice animation though,,"Hamilton, Ontario"
Sat Nov 13 13:27:31 +0000 2021,b'Good decision https://t.co/tKGbo3Qd3b',good decision,Berlin,"Berlin, Germany"
Sat Nov 13 13:28:01 +0000 2021,b'This is just a marvelous piece of science. Science for human health at its best! Congratulations to all researchers\xe2\x80\xa6 https://t.co/35dsM8gLeo',this is just a marvelous piece of science science for human health at its best congratulations to all researchers,"Zurich, Switzerland","Livorno, Tuscany"
Sat Nov 13 13:30:03 +0000 2021,"b'At 8:12a CST today, @EversightVision Medical Director Shahzad I. Mian, MD, presents \xe2\x80\x9cTransmission of Coronavirus vi\xe2\x80\xa6 https://t.co/gPuaOyMX2Y'",at 8 12a cst today medical director shahzad i mian md presents transmission of coronavirus vi,"Ann Arbor, MI","New Orleans, LA"
Sat Nov 13 13:31:25 +0000 2021,b'Thanks @Econdixon and @EconObservatory https://t.co/7SSoD4FbYm',thanks and,"Cardiff, Wales","Cardiff, Wales"
Sat Nov 13 13:32:25 +0000 2021,b'22 more coronavirus related deaths confirmed #LKA #SriLanka',22 more coronavirus related deaths confirmed,Sri Lanka,Sri Lanka
Sat Nov 13 13:32:02 +0000 2021,"b'I don\xe2\x80\x99t know who needs to hear this, but you can get your COVID-19 booster at the same time as your flu shot, and you really should. \xf0\x9f\xa6\xa0\xf0\x9f\xa4\xa7 \xf0\x9f\x92\x89'",i don t know who needs to hear this but you can get your covid 19 booster at the same time as your flu shot and you really should,"San Diego, CA","Tupelo, MS"
Sat Nov 13 13:31:46 +0000 2021,b'@monterogabriela I was wandering the same thing.. #COVID19',i was wandering the same thing,Caracas Venezuela,"Chacao, Venezuela"
Sat Nov 13 13:35:48 +0000 2021,b'@adriandix Dix is this all you do report the body counts?....fyi we get the accurate news hours before you make the\xe2\x80\xa6 https://t.co/FQGQe1q9Rb',dix is this all you do report the body counts fyi we get the accurate news hours before you make the,"Vancouver, British Columbia","Vancouver, British Columbia"
Sat Nov 13 13:34:55 +0000 2021,b'Going to be a depressing read but we need to act on it and learn. This #separation of parents from their #babies mu\xe2\x80\xa6 https://t.co/KSPpqphs1d',going to be a depressing read but we need to act on it and learn this of parents from their mu,"Newcastle Upon Tyne, England","Whitley Bay, England"
Sat Nov 13 13:35:16 +0000 2021,b'@MimiProbably Because @UCPCaucus adults handled the pandemic so well...\n\nMore dead of COVID-19 in Alberta than were\xe2\x80\xa6 https://t.co/jjlWFFRXou',because adults handled the pandemic so well more dead of covid 19 in alberta than were,Edmonton (Treaty 6 land),"Edmonton, Alberta"
Sat Nov 13 13:37:04 +0000 2021,b'Covid has killed more Americans under @POTUS than when Trump was President. #JustFYI #USA #Democrats  #Unemployment\xe2\x80\xa6 https://t.co/1FyhBDv56N',covid has killed more americans under than when trump was president,United States,"Landgraaf, Nederland"
Sat Nov 13 13:37:37 +0000 2021,"b'Not only is this an incredibly beautiful video, it just makes one be in awe because\xe2\x80\xa6.#science. \n\nGreat educ. tool f\xe2\x80\xa6 https://t.co/0284zaAK6L'",not only is this an incredibly beautiful video it just makes one be in awe because great educ tool f,"Maryland, USA","Maryland, USA"
Sat Nov 13 13:37:01 +0000 2021,b'Brilliant https://t.co/imRbGafVGj',brilliant,"Tramore, Ireland","Waterford, Ireland"
Sat Nov 13 13:37:48 +0000 2021,b'Don\xe2\x80\x99t buy it. https://t.co/uOA7sy3aO3',don t buy it,,"Rossington, England"
Sat Nov 13 13:38:41 +0000 2021,b'This is like tasting blood. Having implemented #Lockdown for #COVID19... It dread it will be used for other things.\xe2\x80\xa6 https://t.co/czLPNI6rf7',this is like tasting blood having implemented for it dread it will be used for other things,Bangalore,"Mumbai, India"
Sat Nov 13 13:39:50 +0000 2021,b'Because communities thought \xe2\x80\x9ckids first\xe2\x80\x9d and wouldn\xe2\x80\x99t protect their staff. \xe2\x80\x98Thought mask mandates unnecessary. Woul\xe2\x80\xa6 https://t.co/LRdJfll6TZ',because communities thought kids first and wouldn t protect their staff thought mask mandates unnecessary woul,"Ohio, USA","Five Points, OH"
Sat Nov 13 13:41:39 +0000 2021,b'#Vaccination #Covid19 Cases in #Pune\nWear mask &amp; maintain #CAB #Covid19 #MaskUpPune \n92 New cases \xe2\xac\x86\xef\xb8\x8f\n754 Active \xe2\xac\x87\xef\xb8\x8f\xe2\x80\xa6 https://t.co/fOUu7qKgVo',cases in wear mask amp maintain 92 new cases 754 active,Pune,"Madhya Pradesh, India"
Sat Nov 13 13:41:27 +0000 2021,b'#SCIENCE for the W! https://t.co/FnFKsbwURa',for the w,"Charlottesville, VA","Charlottesville, VA"
Sat Nov 13 13:41:58 +0000 2021,b'@CBSNews *made worse by COVID-19 policies \n\nFixed it for you.',made worse by covid 19 policies fixed it for you,"Queensbury, NY","Glens Falls, NY"
Sat Nov 13 13:42:49 +0000 2021,b'True https://t.co/UCnck4A7UX',true,"Pretoria, South Africa","Pretoria, South Africa"
Sat Nov 13 13:42:28 +0000 2021,b'Can\xe2\x80\x99t wait for this discussion about Covid in schools. I\xe2\x80\x99ve got questions. #teachinginapandemic #teachertwitter https://t.co/mm7BkT5Zfh',can t wait for this discussion about covid in schools i ve got questions,"Memphis, TN","Covington, TN"
Sat Nov 13 13:44:50 +0000 2021,b'She is brave.  Good girl! https://t.co/0Fc9BZwNsp https://t.co/bYkslRzztG',she is brave good girl,,"Bettendorf, IA"
Sat Nov 13 13:43:57 +0000 2021,b'@jaredpolis Where he got the data \xe2\x80\xa6 from @jaredpolis himself. \n\nNYT now shows NM essentially tied with CO in case r\xe2\x80\xa6 https://t.co/r8sOn6bUpl',where he got the data from himself nyt now shows nm essentially tied with co in case r,"Denver, CO","Denver, CO"
Sat Nov 13 13:44:43 +0000 2021,"b'@MeneerJD Beter zoeken dan:\n\nhttps://t.co/uJlPVR3XRr\n\nOccasionally, a\xc2\xa0mutation\xc2\xa0can help the virus get into the body\xe2\x80\xa6 https://t.co/hddAr6ta8o'",beter zoeken dan occasionally a mutation can help the virus get into the body,Narnia,"Delft, Nederland"
Sat Nov 13 13:44:42 +0000 2021,b'Peopleeeee https://t.co/iJYcRpJmbH',peopleeeee,"Treaty 1, Winnipeg, Manitoba","Winnipeg, Manitoba"
Sat Nov 13 13:45:28 +0000 2021,b'Hospitalizations and ICU are now rising.... https://t.co/KZf7svoKyG',hospitalizations and icu are now rising,,"Kerry, Ireland"
Sat Nov 13 13:46:50 +0000 2021,b'On a train to Twickenham to see #ENGvAUS - not a single man wearing a mask - not one\xe2\x80\xa6\xf0\x9f\xa4\xac\xf0\x9f\x98\xb7 #COVID19',on a train to twickenham to see not a single man wearing a mask not one,United Kingdom,"Lambeth, London"
Sat Nov 13 13:47:45 +0000 2021,"b'Important message, but anyone know why this is just being pushed now? Did I miss some new science? https://t.co/uGCWYsSlnm'",important message but anyone know why this is just being pushed now did i miss some new science,,"Toronto, Ontario"
Sat Nov 13 13:49:54 +0000 2021,"b'Not if @RonDeSantisFL, @GregAbbott_TX, Murdoch, @TuckerCarlson, @seanhannity, et al can help it. https://t.co/l9rTaVYfxK'",not if murdoch et al can help it,🗽🇵🇷,"Manhattan, NY"
Sat Nov 13 13:50:06 +0000 2021,"b""Gay Simpsons' character Smithers gets first boyfriend five years after coming out on the cartoon: U.K. \xc2\xb7 Latest hea\xe2\x80\xa6 https://t.co/K8RetwI4fQ""",gay simpsons character smithers gets first boyfriend five years after coming out on the cartoon u k latest hea,Americas | United Kingdom,"London, England"
Sat Nov 13 13:49:39 +0000 2021,b'Apparently Journalists know more than anyone maybe we should put them in charge what could possibly go wrong .\xe2\x80\xa6 https://t.co/glRiHWEMTV',apparently journalists know more than anyone maybe we should put them in charge what could possibly go wrong,Ireland,"Kildare, Ireland"
Sat Nov 13 13:53:40 +0000 2021,b'Your new neigbours @_bpaigeyu_ https://t.co/BOaNnaLiKi',your new neigbours,Nigeria🇳🇬,"Abuja, Nigeria"
Sat Nov 13 13:54:56 +0000 2021,b'Ministry of Health DG CGHS.Special Permission to buy OPD Medicines in view of Covid19 not extended beyond 31 Octobe\xe2\x80\xa6 https://t.co/CWjeGLWz4c',ministry of health dg cghs special permission to buy opd medicines in view of covid19 not extended beyond 31 octobe,"New Delhi, India","New Delhi, India"
Sat Nov 13 13:54:41 +0000 2021,"b'#Life in #Pandemic,\nA Tale of #COVID19! https://t.co/X1NEEIG7y8'",in a tale of,New Delhi/Balasore/Jatni,"Jatani, Orissa"
Sat Nov 13 13:56:10 +0000 2021,b'How COVID-19 mRNA Vaccines Work https://t.co/xDZBdOBbYi via @YouTube',how covid 19 mrna vaccines work via,St. Louis - hey Jack Dorsey!,"Webster Groves, MO"
Sat Nov 13 13:55:42 +0000 2021,b'Great resource for #biology #k12 #edchat #edchatmn https://t.co/scCfoPeKIK',great resource for,"Dundas, MN","Minnesota, USA"
Sat Nov 13 13:55:01 +0000 2021,b'Do you have a little time to help Jai with her research? https://t.co/Jrqj0lbVjY',do you have a little time to help jai with her research,"Edinburgh, Scotland","Queensferry, Scotland"
Sat Nov 13 13:59:36 +0000 2021,"b'Daily goals: 1) Saturday home day, make plans for the day; 2) get COVID-19 booster vaccine; 3) long leisurely walk;\xe2\x80\xa6 https://t.co/frltoQHMcq'",daily goals 1 saturday home day make plans for the day 2 get covid 19 booster vaccine 3 long leisurely walk,,"Manhattan, NY"
