created_at,text,clean-text,location,place
Sat Nov 13 16:19:55 +0000 2021,b'Well done to everyone involved in such a great event and so quickly!  You pulled it of and the technology worked! \xf0\x9f\x91\x8f\xe2\x80\xa6 https://t.co/6inX6qlwqT',well done to everyone involved in such a great event and so quickly you pulled it of and the technology worked,"Nairn, Scotland","Inverness, Scotland"
Sat Nov 13 16:20:03 +0000 2021,b'Cold virus doesn\xe2\x80\x99t usually kill you. Covid19 can and will. Ask the 760thousand people who are dead. Get vaccinated. https://t.co/3JR22EmLMS',cold virus doesn t usually kill you covid19 can and will ask the 760thousand people who are dead get vaccinated,"Blandon, PA","Blandon, PA"
Sat Nov 13 16:21:31 +0000 2021,"b'November 10, 2021.\n\nCOVID-19 vaccination  Roll-Out to PNP Personnel and distribution of Medical and Dental IEC Mate\xe2\x80\xa6 https://t.co/EBc8swjlWp'",november 10 2021 covid 19 vaccination roll out to pnp personnel and distribution of medical and dental iec mate,Catbalogan City,"Tacloban City, Eastern Visayas"
Sat Nov 13 16:22:34 +0000 2021,b'Coronavirus youth and old people coronavirus death https://t.co/swS0G7pUWK',coronavirus youth and old people coronavirus death,,"Salem, India"
Sat Nov 13 16:24:35 +0000 2021,"b""I could have sworn that this isn't how it works though https://t.co/qHmGAGHacI""",i could have sworn that this isnt how it works though,"727 bred, 919 ""visiting""","Valdosta, GA"
Sat Nov 13 16:23:16 +0000 2021,b'Loves life\n\nCoronavirus death https://t.co/2l7kg5Rymo',loves life coronavirus death,,"Salem, India"
Sat Nov 13 16:23:04 +0000 2021,b'Nice #covid #vaccine animation https://t.co/aQ4XHWFXVx',nice animation,"43.63145,-79.37142","Attiki, Greece"
Sat Nov 13 16:25:07 +0000 2021,b'https://t.co/xfb16ckUnp Solution for Teledental Practice in the Time of COVID-19 https://t.co/O0EkxVeLU1 via @AmTeledentAssn',solution for teledental practice in the time of covid 19 via,,"Pico Rivera, CA"
Sat Nov 13 16:25:30 +0000 2021,b'Coronavirus\n\nMy home marriage every day fight please my WhatsApp tell me https://t.co/bvqDJKsAH5',coronavirus my home marriage every day fight please my whatsapp tell me,,"Salem, India"
Sat Nov 13 16:25:06 +0000 2021,b'Another one bite the dust\n@LcdoCorona @Gw13Bi @JoannieRose78 @MousWatch @YoouurrMama @Hol_Shayer https://t.co/O4tTrCCqJi',another one bite the dust,"Suwanee, GA","Georgia, USA"
Sat Nov 13 16:24:47 +0000 2021,"b'Qatar\xe2\x80\x99s revised red list effective from November 15th includes the UAE, Turkey, UK and Russia. Interestingly, the U\xe2\x80\xa6 https://t.co/qAZlkDSO31'",qatar s revised red list effective from november 15th includes the uae turkey uk and russia interestingly the u,"Dubai, United Arab Emirates","Dubai, United Arab Emirates"
Sat Nov 13 16:26:13 +0000 2021,b'Coronavirus marriage home marriage small group marriage and low budget cost marriage https://t.co/Xua4My3oZ2',coronavirus marriage home marriage small group marriage and low budget cost marriage,,"Salem, India"
Sat Nov 13 16:26:24 +0000 2021,b'Totally how the nfl would have handled this if Rodgers was on the Patriots! https://t.co/kWgy0fXHuC',totally how the nfl would have handled this if rodgers was on the patriots,"Boston, MA","Taunton, MA"
Sat Nov 13 16:27:49 +0000 2021,"b'Taking the boys to get their #COVID19 Vaccine, and they just announced they are out of Pfizer for ages 12+ https://t.co/uCwmfUYgR2'",taking the boys to get their vaccine and they just announced they are out of pfizer for ages 12,"Orlando, FL",Timber Creek High School
Sat Nov 13 16:26:31 +0000 2021,"b'#Vaccine efficacy against infection with #sarscov2 drops significantly months after #vaccination, and most signific\xe2\x80\xa6 https://t.co/up83fGdSTA'",efficacy against infection with drops significantly months after and most signific,"Boston, MA, USA","Boston, MA"
Sat Nov 13 16:26:21 +0000 2021,"b""If you're curious about how the COVID-19 vaccine works, this is worth a watch. #ScienceElevated https://t.co/Y0PT9pZljS""",if youre curious about how the covid 19 vaccine works this is worth a watch,The Nearest Trail,"Palmer Lake, CO"
Sat Nov 13 16:28:37 +0000 2021,b'Mike Lee is all in favor of boosting the spread of COVID https://t.co/hJv1cAYlqG',mike lee is all in favor of boosting the spread of covid,Salt Lake City,"Salt Lake City, UT"
Sat Nov 13 16:28:32 +0000 2021,"b'On Tues, Nov. 16th (8:30am to 1 pm), @MDCPS has partnered with the @HealthyFla to offer the Pfizer Pediatric COVID-\xe2\x80\xa6 https://t.co/8300I3rTwK'",on tues nov 16th 8 30am to 1 pm has partnered with the to offer the pfizer pediatric covid,Miami Florida,"Westview, FL"
Sat Nov 13 16:31:01 +0000 2021,b'#Lrd_male_2500 appointment letter. @Bhupendrapbjp\n@CMOGuj\n@CRPaatil\n@sanghaviharsh\nStudents have been in demand for\xe2\x80\xa6 https://t.co/QIxhAHToEs',appointment letter students have been in demand for,,"Gujarat, India"
Sat Nov 13 16:30:19 +0000 2021,"b""I've seen this false claim on #Covid19 vaccines around. Glad the CDC has finally put out a statement that others ca\xe2\x80\xa6 https://t.co/4Kz5kPrNaJ""",ive seen this false claim on vaccines around glad the cdc has finally put out a statement that others ca,Iowa,"Burlington, IA"
Sat Nov 13 16:29:55 +0000 2021,"b""@anthonyzenkus These suponeas aren't going anywhere. A complicit DOJ continues to sit on them, &amp; meanwhile Coronavi\xe2\x80\xa6 https://t.co/bLpbE4wnHz""",these suponeas arent going anywhere a complicit doj continues to sit on them amp meanwhile coronavi,,"Ocoee, FL"
Sat Nov 13 16:32:14 +0000 2021,b'But her emails! https://t.co/2rdofMvFso',but her emails,"Norman, OK Boomer","Norman, OK"
Sat Nov 13 16:31:46 +0000 2021,b'TIME TO ROLLLLLLL 12! https://t.co/87sdX39x97',time to rolllllll 12,"Wauwatosa, WI","Milwaukee, WI"
Sat Nov 13 16:33:15 +0000 2021,b'Bruce #covid19 test kits at pharmacy https://t.co/DHI9Fpopni',bruce test kits at pharmacy,"Brechin, Ontario, Canada","Ramara, Ontario"
Sat Nov 13 16:33:09 +0000 2021,b'Thought for a minute I had had a long nap and woke up April 1st. #COVID19 https://t.co/6Dmxdj267u',thought for a minute i had had a long nap and woke up april 1st,"Stratford, London","Stratford, London"
Sat Nov 13 16:34:41 +0000 2021,b'REPUBLICANS are against ending the #pandemic #COVID19  #CrossConnection',republicans are against ending the,"Washington, DC","Washington, DC"
Sat Nov 13 16:36:36 +0000 2021,b'You see\xe2\x80\xa6simple as that.  #VaccinesWork https://t.co/1J2BGqRqDN',you see simple as that,"Simpsonville, SC","Texas, USA"
Sat Nov 13 16:37:25 +0000 2021,"b""#onpoli #Cdnpoli reflects people's desire to move away from heavily populated areas, increasing demand and raising\xe2\x80\xa6 https://t.co/GLJq7sOtle""",reflects peoples desire to move away from heavily populated areas increasing demand and raising,"Brechin, Ontario, Canada","Ramara, Ontario"
Sat Nov 13 16:38:03 +0000 2021,"b""@Dimensionspect1 I know someone who just lost his 64 year old brother to COVID-19 and he's still not vaccinated""",i know someone who just lost his 64 year old brother to covid 19 and hes still not vaccinated,"Richmond, VA","Forestville, MD"
Sat Nov 13 16:37:19 +0000 2021,"b""Someone care to explain this. ? \n\nI've had both my covid jabs. \n\n#COVID19 https://t.co/XUZP8zPFn9""",someone care to explain this ive had both my covid jabs,Stoke-On-Trent,"Alsager, England"
Sat Nov 13 16:38:28 +0000 2021,"b'Icymi @GovStitt fired his guard general, a supporter of science and follower of orders, with a science denier who c\xe2\x80\xa6 https://t.co/FYmq1fVigc'",icymi fired his guard general a supporter of science and follower of orders with a science denier who c,"Manhattan, NY","Manhattan, NY"
Sat Nov 13 16:38:44 +0000 2021,b'#BrazilGP #JENNIE #3YEARSWITHSOLO #JENNIE SOLO ANNIVERSARY #\xea\xb5\xac\xeb\xa6\x84\xec\x9c\x84\xec\x97\x90_\xeb\xb3\x84\xeb\x93\xa4\xeb\xb3\xb4\xeb\x8b\xa4_\xeb\xb9\x9b\xeb\x82\x98\xeb\x8a\x94_3\xec\xa3\xbc\xeb\x85\x84 COVID19 greenpeace #LISA https://t.co/SaMVEDzc3J',solo anniversary 3 covid19 greenpeace,"Москва, Россия","Moscow, Russia"
Sat Nov 13 16:38:44 +0000 2021,"b""RNAO's Assembly of Leaders address issues in Nursing: HR Crisis of RNs &amp; Impact on PTS' outcomes, Fear of COVID-19\xe2\x80\xa6 https://t.co/xrniX2eVw2""",rnaos assembly of leaders address issues in nursing hr crisis of rns amp impact on pts outcomes fear of covid 19,,"Whitby, Ontario"
Sat Nov 13 16:39:30 +0000 2021,"b'715 new cases, Dr. Tam did say, they were expecting for cases to rise because of easing of restrictions and get thi\xe2\x80\xa6 https://t.co/f7EVhkUIef'",715 new cases dr tam did say they were expecting for cases to rise because of easing of restrictions and get thi,"Waskaganish, Quebec","Val-d'Or, Québec"
Sat Nov 13 16:39:57 +0000 2021,b'@briankoppelman There\xe2\x80\x99s a reason Florida leads the nation in Covid-19 deaths',there s a reason florida leads the nation in covid 19 deaths,"Youngstown, Ohio","Struthers, OH"
Sat Nov 13 16:40:15 +0000 2021,b'Packers QB Aaron Rodgers will be activated off the Covid-19 list and will start on Sunday vs the Seahawks.\n\nAaron Rodgers vs Russell Wilson.',packers qb aaron rodgers will be activated off the covid 19 list and will start on sunday vs the seahawks aaron rodgers vs russell wilson,"Barnegat, NJ","Florida, USA"
Sat Nov 13 16:42:13 +0000 2021,b'I think its time to set the Twitter machine down for now. \xf0\x9f\xa4\xa6\xe2\x80\x8d\xe2\x99\x80\xef\xb8\x8f\xf0\x9f\xa4\xaf https://t.co/9QR8peZm0i',i think its time to set the twitter machine down for now,"Prince George, British Columbi","Prince George, British Columbia"
Sat Nov 13 16:41:59 +0000 2021,b'Time to make that COVID-19 paper!!! \xf0\x9f\x98\xb7\xf0\x9f\xa6\xa0\xf0\x9f\xa7\xbb\xf0\x9f\x92\xb5\xf0\x9f\x99\x8c\xf0\x9f\x8f\xbc\xf0\x9f\x92\xaf\xf0\x9f\xa4\x99\xf0\x9f\x8f\xbc',time to make that covid 19 paper,"Kailua, HI 96734","Kailua, HI"
Sat Nov 13 16:44:01 +0000 2021,b'Now we go! https://t.co/LoEW62VsXi',now we go,"South Milwaukee, Wisconsin","South Milwaukee, WI"
Sat Nov 13 16:44:15 +0000 2021,b'Preparing for your COVID-19 test | CVS Pharmacy https://t.co/uyAsDBSBsJ via @YouTube',preparing for your covid 19 test cvs pharmacy via,Tampa,"Temple Terrace, FL"
Sat Nov 13 16:46:40 +0000 2021,b'Sometimes I wonder if these people are so pro vax mandate because they spent months contributing to vax hesitancy a\xe2\x80\xa6 https://t.co/g8Cnf88cDi',sometimes i wonder if these people are so pro vax mandate because they spent months contributing to vax hesitancy a,Valley of the Sun ☀️,"Scottsdale, AZ"
Sat Nov 13 16:46:58 +0000 2021,b'So ignoring your higher ups is grounds for firing in the workplace ! These people need to be fired ! https://t.co/5QwXCum6Xu',so ignoring your higher ups is grounds for firing in the workplace these people need to be fired,"College Station, TX","College Station, TX"
Sat Nov 13 16:47:17 +0000 2021,"b""Hi I'm Cleo a sweet 6 year old girl looking for a home where I will get lots of head scratches!\n\nAdoptions are by a\xe2\x80\xa6 https://t.co/exgIn0ArkH""",hi im cleo a sweet 6 year old girl looking for a home where i will get lots of head scratches adoptions are by a,"London, ON","London, Ontario"
Sat Nov 13 16:48:56 +0000 2021,b'COVID-19 cases climb for 1st time in weeks https://t.co/1IZVzrGhog via @YouTube',covid 19 cases climb for 1st time in weeks via,"Farmington Hills, MI","Ypsilanti, MI"
Sat Nov 13 16:49:57 +0000 2021,"b'What we are witnessing is Capitalism in its last throes. \n\nClimate Change, Coronavirus, Inflation, the rise of Neo-\xe2\x80\xa6 https://t.co/SxQ0ezuwc0'",what we are witnessing is capitalism in its last throes climate change coronavirus inflation the rise of neo,,"Ocoee, FL"
Sat Nov 13 16:48:37 +0000 2021,"b'Two kissing cranes mark the entrance of the \xc3\x96kologische Station G\xc3\xbclpe @unipotsdam. Whitetailed eagles in the sky, a\xe2\x80\xa6 https://t.co/5XBrVMAiuI'",two kissing cranes mark the entrance of the kologische station g lpe whitetailed eagles in the sky a,"Munich, Bavaria",Ökologische Station Gülpe
Sat Nov 13 16:48:50 +0000 2021,b'COVID-19 cases climb for 1st time in weeks https://t.co/jTrj4xHbnA via @YouTube',covid 19 cases climb for 1st time in weeks via,"Novi, MI","Ypsilanti, MI"
Sat Nov 13 16:51:20 +0000 2021,"b'""Difficult weeks lie ahead of us, and you can see that I am very worried. I urgently ask everyone who has not yet b\xe2\x80\xa6 https://t.co/pYuzKYtkJn'",difficult weeks lie ahead of us and you can see that i am very worried i urgently ask everyone who has not yet b,On the road again,"Hanover, Germany"
Sat Nov 13 16:51:09 +0000 2021,b'This didn\xe2\x80\x99t age well\xe2\x80\xa6 on so many levels. https://t.co/5p5irD9yCO',this didn t age well on so many levels,"Austin, TX","Austin, TX"
Sat Nov 13 16:53:14 +0000 2021,b'Evil democrat Biden is destroying great USA \xf0\x9f\x87\xba\xf0\x9f\x87\xb8 Keep Americans Safe from evil illegal aliens destroying USA \xf0\x9f\x87\xba\xf0\x9f\x87\xb8 https://t.co/w2Lhh6uE3Y',evil democrat biden is destroying great usa keep americans safe from evil illegal aliens destroying usa,,"Menlo Park, CA"
Sat Nov 13 16:54:26 +0000 2021,"b'This is huge. Get your booster, New Mexicans! \xe2\xac\x87\xef\xb8\x8f\xe2\xac\x87\xef\xb8\x8f\xe2\xac\x87\xef\xb8\x8f https://t.co/saNQfV1btN'",this is huge get your booster new mexicans,"Albuquerque, NM","Albuquerque, NM"
Sat Nov 13 16:54:42 +0000 2021,b'Covid-19 Super Boosted \xf0\x9f\x92\xaa \xf0\x9f\x92\x89 \nI love that I can add my vaccination card to Apple Wallet now',covid 19 super boosted i love that i can add my vaccination card to apple wallet now,"Kansas City, MO","Missouri, USA"
Sat Nov 13 16:54:18 +0000 2021,b'Booster shot done \xf0\x9f\x92\x89 = 3rd vaccination against Covid-19 \xe2\x9c\x85 https://t.co/8PYlFPp19B',booster shot done 3rd vaccination against covid 19,"Neuwied, Deutschland","Neuwied, Deutschland"
Sat Nov 13 16:54:10 +0000 2021,"b'@Pandion_Knight @TheBurgessness @raggedlines I\xe2\x80\x99m on your side bro but coronavirus has been around for 10,s of thous\xe2\x80\xa6 https://t.co/NU3je28Aeq'",i m on your side bro but coronavirus has been around for 10 s of thous,"Marlow, Buckinghamshire","High Wycombe, England"
Sat Nov 13 16:56:57 +0000 2021,b'How COVID-19 mRNA Vaccines Work https://t.co/dJlw9QEl7i via @YouTube',how covid 19 mrna vaccines work via,"Lake Forest, CA","Lake Forest, CA"
Sat Nov 13 16:55:41 +0000 2021,b'Garbage in garbage out. https://t.co/vSZTk6ExE8',garbage in garbage out,"Ontario, Canada","Hamilton, Ontario"
Sat Nov 13 16:57:39 +0000 2021,"b'Be very interested if Aaron Rodgers has to do the compulsory gameday COVID-19 test, with a negative result - like t\xe2\x80\xa6 https://t.co/2vrW9cUgDq'",be very interested if aaron rodgers has to do the compulsory gameday covid 19 test with a negative result like t,"Charleston, SC","Moncks Corner, SC"
Sat Nov 13 16:59:56 +0000 2021,b'COVID-19 vaccine clinic happening now at Goodnight Middle School today from 9am-2pm. https://t.co/pojb2pl4bk',covid 19 vaccine clinic happening now at goodnight middle school today from 9am 2pm,"San Marcos, Texas","San Marcos, TX"
Sat Nov 13 17:01:23 +0000 2021,b'@JudgeClayJ If you cared about Dallas County you would retire and go back to chasing ambulances and looking for sli\xe2\x80\xa6 https://t.co/ohg26d0gGQ',if you cared about dallas county you would retire and go back to chasing ambulances and looking for sli,Dallas County Texas,"Texas, USA"
Sat Nov 13 17:01:33 +0000 2021,"b'Unvaccinated Texans make up vast majority of COVID-19 cases and deaths this year, new state data shows https://t.co/R2EmOIP8VT'",unvaccinated texans make up vast majority of covid 19 cases and deaths this year new state data shows,Canada,"Yellowhead County, Alberta"
Sat Nov 13 17:02:16 +0000 2021,b'Annnd Ont Covid cases riseabove 600 today!Coincidence? I think not!unvaxxed kids in schools and day cares...governm\xe2\x80\xa6 https://t.co/TzP23OxSWt',annnd ont covid cases riseabove 600 today coincidence i think not unvaxxed kids in schools and day cares governm,The BEACH inToronto,"Toronto, Ontario"
Sat Nov 13 17:06:02 +0000 2021,"b'I\xe2\x80\x99ve had three full doses not just two and a booster, but three full doses. I\xe2\x80\x99m also immunocompromised, so \xf0\x9f\xa4\x9e\xf0\x9f\x8f\xbd\xf0\x9f\xa4\x9e\xf0\x9f\x8f\xbd\xf0\x9f\xa4\x9e\xf0\x9f\x8f\xbd\xf0\x9f\xa4\x9e\xf0\x9f\x8f\xbd\xe2\x80\xa6 https://t.co/U5kxJVaYhH'",i ve had three full doses not just two and a booster but three full doses i m also immunocompromised so,"Hocketown West, High 5 State","Dorr, MI"
Sat Nov 13 17:05:39 +0000 2021,b'Borax and baking soda? You\xe2\x80\x99re getting a vaccine not doing a load of fucking laundry. Knock it off! \xf0\x9f\xa4\xa6\xf0\x9f\x8f\xbb\xe2\x80\x8d\xe2\x99\x80\xef\xb8\x8f\xf0\x9f\xa4\xa6\xf0\x9f\x8f\xbb\xe2\x80\x8d\xe2\x99\x80\xef\xb8\x8f https://t.co/PRLJuBLchs',borax and baking soda you re getting a vaccine not doing a load of fucking laundry knock it off,"Silver Spring, MD","Silver Spring, MD"
Sat Nov 13 17:07:45 +0000 2021,b'When is the @nzherald going to run an article about how John Key was wrong about covid19 and NZ response? https://t.co/dbUQvRQlnk',when is the going to run an article about how john key was wrong about covid19 and nz response,"Auckland, New Zealand","Auckland, New Zealand"
Sat Nov 13 17:08:56 +0000 2021,b'Science is awesome https://t.co/ySDkDdsp22',science is awesome,,"Kansas City, MO"
Sat Nov 13 17:11:08 +0000 2021,b'Kansas Republican leaders condemn comparisons of COVID-19 mandates and Holocaust https://t.co/tNuRbaF0yB',kansas republican leaders condemn comparisons of covid 19 mandates and holocaust,Canada,"Yellowhead County, Alberta"
Sat Nov 13 17:13:48 +0000 2021,b'Remember this https://t.co/l9RkfM024m',remember this,"New Orleans, LA","Islamorada, FL"
Sat Nov 13 17:15:17 +0000 2021,"b'@bickley200 @dr_musgrave Masks do decrease the risk of transmission. \nWith COVID19, often people are infectious bef\xe2\x80\xa6 https://t.co/rn13UzsFt3'",masks do decrease the risk of transmission with covid19 often people are infectious bef,Cambridge,"Cambridge, England"
Sat Nov 13 17:16:35 +0000 2021,b'\xf0\x9f\x91\x8e\xf0\x9f\x8f\xbd#NFL Justice for @Kaepernick7 https://t.co/7mVy4fqZzS',justice for,"West Des Moines, IA","West Des Moines, IA"
Sat Nov 13 17:16:22 +0000 2021,b'People have spoken and they don\xe2\x80\x99t want to show proof of vaccination. https://t.co/esXGJK4IdA',people have spoken and they don t want to show proof of vaccination,Biggest Little City,"Reno, NV"
Sat Nov 13 17:18:11 +0000 2021,b'\xf0\x9f\x92\x94\xf0\x9f\x98\xadthread https://t.co/EDzAKVs3kR',thread,"San Francisco, CA","San Francisco, CA"
Sat Nov 13 17:18:13 +0000 2021,b'The biggest problem here is that folks don\xe2\x80\x99t understand those shifting dynamics. They were told (2) shots and you\xe2\x80\x99r\xe2\x80\xa6 https://t.co/4Dn2eOCCJz',the biggest problem here is that folks don t understand those shifting dynamics they were told 2 shots and you r,"Los Angeles, CA","Los Angeles, CA"
Sat Nov 13 17:18:32 +0000 2021,b'My COVID king is back \xf0\x9f\x98\x8d https://t.co/gYvTsO55pu',my covid king is back,,"San Francisco, CA"
Sat Nov 13 17:18:25 +0000 2021,b'I think that Covid-19 got to Tony Elliott\xe2\x80\x99s head awhile back. Those play calls got me scratching my head.',i think that covid 19 got to tony elliott s head awhile back those play calls got me scratching my head,"Seneca, SC","South Carolina, USA"
Sat Nov 13 17:17:43 +0000 2021,b'In our latest Wear The Gown with @UnivHealthSA we find out from Dr. Solis-Herrera that if you get the coronavirus y\xe2\x80\xa6 https://t.co/86hPjembJK',in our latest wear the gown with we find out from dr solis herrera that if you get the coronavirus y,"San Antonio, TX","San Antonio, TX"
Sat Nov 13 17:20:21 +0000 2021,b'Feel Proud. \xf0\x9f\x91\x8f\xf0\x9f\x91\x8f https://t.co/NZ3ZgSFMom',feel proud,"Kolkata, India","Kolkata, India"
Sat Nov 13 17:21:32 +0000 2021,b'More national coverage of the fallout from @govstitt\xe2\x80\x99s abrupt firing of the head of the @OKGuard and the new leader\xe2\x80\xa6 https://t.co/7D1H8pwzV8',more national coverage of the fallout from s abrupt firing of the head of the and the new leader,"Tulsa, OK, by way of NY/NJ","Grapevine, TX"
Sat Nov 13 17:24:45 +0000 2021,b'The man is back in town https://t.co/pyAYcMuhpL',the man is back in town,"Minster, OH","Columbus, OH"
Sat Nov 13 17:24:37 +0000 2021,"b""@KimRuxton @DrEricDing @vaccinemakers @ChildrensPhila Who would've KNOWN=The offices set up by @BarackObama oversea\xe2\x80\xa6 https://t.co/uUhBV4JNo4""",who wouldve known the offices set up by oversea,Rutland VT.,"Rutland, VT"
Sat Nov 13 17:23:20 +0000 2021,b'This is a fantastic video showing how COVID-19 vaccines work. For sure will be sharing this with my team 1st thing\xe2\x80\xa6 https://t.co/QFLlIiUtXw',this is a fantastic video showing how covid 19 vaccines work for sure will be sharing this with my team 1st thing,"Reno, NV","Reno, NV"
Sat Nov 13 17:25:01 +0000 2021,"b'Soon in #Katara on the occasion of the #International_Childrens_Day #GoBlue, the 2nd edition of the\xe2\x80\xa6 https://t.co/SYM6osEfjf'",soon in on the occasion of the the 2nd edition of the,"Doha, Qatar","Doha, Qatar"
Sat Nov 13 17:29:32 +0000 2021,b'@AdamSchefter @NFL needs to suspend him for the #Covid19 false statements for at least a game to set an example\xe2\x80\xa6Ith\xe2\x80\xa6 https://t.co/WPHYTLvjq7',needs to suspend him for the false statements for at least a game to set an example ith,"California, USA","Chino, CA"
Sat Nov 13 17:32:04 +0000 2021,b'Latest from Beijing #China : No one with a history of travel to any area with more than 1 infection #COVID19 in the\xe2\x80\xa6 https://t.co/eA1soNi5dn',latest from beijing no one with a history of travel to any area with more than 1 infection in the,République populaire de Chine,"Beijing, People's Republic of China"
Sat Nov 13 17:32:21 +0000 2021,"b'\xe2\x80\x9cEvery day, there are six times more boosters administered globally than primary doses in low-income countries,\xe2\x80\x9d\xe2\x80\xa6 https://t.co/rXa6n41dl7'",every day there are six times more boosters administered globally than primary doses in low income countries,Norway,"Oslo, Norway"
Sat Nov 13 17:32:45 +0000 2021,b'Pretty disgusting stuff https://t.co/IHbMAZVSqI',pretty disgusting stuff,"Kolkata, India","Kolkata, India"
Sat Nov 13 17:31:30 +0000 2021,b'Maxence Guenette ex-@Chevaliersaaa \xf0\x9f\x92\xaa\xf0\x9f\x92\xaa\xf0\x9f\x92\xaa https://t.co/Jr3Jcxn0we',maxence guenette ex,"Québec, Canada","Québec, Canada"
Sat Nov 13 17:33:46 +0000 2021,b'And the evidence upon its approaching in the news of the Great Quran is that Coronavirus shall invade the world fro\xe2\x80\xa6 https://t.co/iyvWHzkIDU',and the evidence upon its approaching in the news of the great quran is that coronavirus shall invade the world fro,,Yemen
Sat Nov 13 17:33:49 +0000 2021,b'This cool video by @vaccinemakers is helpful in understanding how #COVID19 vaccine works. https://t.co/J56lsEIzzF',this cool video by is helpful in understanding how vaccine works,"Oak Cliff, TX","Dallas, TX"
Sat Nov 13 17:35:21 +0000 2021,b'Congratulations and well done to all involved. Great to see you get the deserved recognition for all your hard work. https://t.co/Ndsrjv7xNC',congratulations and well done to all involved great to see you get the deserved recognition for all your hard work,"Cork, Ireland","Cork, Ireland"
Sat Nov 13 17:36:55 +0000 2021,b'Walk-ins are available at MLK Middle School for vaccinations today for children 5-11. Come now until 3 p.m.\xe2\x80\xa6 https://t.co/MhYOUrQBY6',walk ins are available at mlk middle school for vaccinations today for children 5 11 come now until 3 p m,"Richmond, VA","Richmond, VA"
Sat Nov 13 17:36:18 +0000 2021,"b'Oh as it also prevented and treated #COVID19 !! \n\nWhy do we needs scientists / economists and education after all ,\xe2\x80\xa6 https://t.co/COA6jH7iM2'",oh as it also prevented and treated why do we needs scientists economists and education after all,"Hyderabad, India","Hyderabad, India"
Sat Nov 13 17:38:16 +0000 2021,b'Obvio https://t.co/wBvnomOsQj',obvio,"Los Angeles, CA","Rosario, Argentina"
Sat Nov 13 17:38:09 +0000 2021,b'ICYMI people with the vaccine can still get the virus - it was never \xf0\x9f\x92\xaf- but they seem to get milder symptoms. https://t.co/whACPhw85Q',icymi people with the vaccine can still get the virus it was never but they seem to get milder symptoms,"Montrose, Colorado","Colorado, USA"
Sat Nov 13 17:39:34 +0000 2021,b'12th Nov Summary #Bengaluru #COVID19 as per @BBMPCOMM\n\nTests \xe2\xac\x87\xef\xb8\x8f to 40.3K \xf0\x9f\x98\x94\nDaily Positives \xe2\xac\x87\xef\xb8\x8f to 147 \xf0\x9f\x91\x8d\xf0\x9f\x8f\xbb\nDeaths \xe2\xac\x87\xef\xb8\x8f t\xe2\x80\xa6 https://t.co/qGy5a0gGn4',12th nov summary as per tests to 40 3k daily positives to 147 deaths t,"Bengaluru, India","Bengaluru, India"
Sat Nov 13 17:40:20 +0000 2021,"b""Covid-19 test number ??? Seriously folks, get a mask.  I'm mobile, other immunocompromised folks aren't. Kinda tired of qTips up my nose.""",covid 19 test number seriously folks get a mask im mobile other immunocompromised folks arent kinda tired of qtips up my nose,Earth,"Mentor, OH"
Sat Nov 13 17:38:58 +0000 2021,b'A useful and informative text on Covid-19 at home. https://t.co/vYCPJ9MdXY',a useful and informative text on covid 19 at home,Essex,"Bradford, England"
Sat Nov 13 17:39:22 +0000 2021,b'More nannites injected into my body that will travel to my brain and make me subservient.  \n\nYeah right.....\xe2\x80\xa6 https://t.co/ugsGu0UUyo',more nannites injected into my body that will travel to my brain and make me subservient yeah right,Milton Keynes,"Milton Keynes, England"
