created_at,text,clean-text,location,place
Sat Nov 13 22:25:37 +0000 2021,b'IDIOTS FOLLOWING TO LIE BY MEDIA!\n\nMost states see rising COVID cases as winter surge fears grow; some states expan\xe2\x80\xa6 https://t.co/i9K8385TE4',idiots following to lie by media most states see rising covid cases as winter surge fears grow some states expan,,"Phoenix, AZ"
Sat Nov 13 22:24:20 +0000 2021,b'Tin Man Joe wants to destroy America with his COVID MANDATES!\n\nDo you think \xf0\x9f\xa4\x94 Nero laughed like this \xf0\x9f\x91\x8ewhen Roman de\xe2\x80\xa6 https://t.co/T5cA0RxxAb',tin man joe wants to destroy america with his covid mandates do you think nero laughed like this when roman de,"Arlington, Virginia","Charlottesville, VA"
Sat Nov 13 22:26:33 +0000 2021,b'How\xe2\x80\x99s that happened then ref https://t.co/BnAqyVZqBx',how s that happened then ref,Isle Of Wight / Manchester,"Manchester, England"
Sat Nov 13 22:28:30 +0000 2021,b'Finally! https://t.co/ALPhEl5xDY',finally,,"Poynton, England"
Sat Nov 13 22:31:23 +0000 2021,b'Everyone gets to go back to work.  And a Big Fck You to the Incompetent Biden Administration. https://t.co/We4NkTQmLe',everyone gets to go back to work and a big fck you to the incompetent biden administration,Deep South Texas,"Rancho Viejo, TX"
Sat Nov 13 22:30:59 +0000 2021,b'Let\xe2\x80\x99s help each other stay healthy. https://t.co/ipvhzmlrTH',let s help each other stay healthy,Dallas,"Dallas, TX"
Sat Nov 13 22:31:09 +0000 2021,b'weird https://t.co/0m9qtxt2Ug',weird,"Birkenhead, England","Wallasey, England"
Sat Nov 13 22:31:14 +0000 2021,b'@geoffcoffin @AZDHS Would be nice if our news media would publish more details as they do in other states. The news\xe2\x80\xa6 https://t.co/rGtrg1DK4I',would be nice if our news media would publish more details as they do in other states the news,"Arizona, USA","Arizona, USA"
Sat Nov 13 22:30:11 +0000 2021,b'If D-RATS manage it... D-RATS ravage it!\xf0\x9f\x98\xa1 https://t.co/JCMPiHINKr https://t.co/zjLeK5Fkn2',if d rats manage it d rats ravage it,"Nashville, TN","Nashville, TN"
Sat Nov 13 22:32:22 +0000 2021,"b""\xf0\x9f\x98\xac It's litterly like a match in a tinder box if it gets anywhere. https://t.co/QBrpBsuetv""",its litterly like a match in a tinder box if it gets anywhere,"Timaru District, New Zealand","Timaru District, New Zealand"
Sat Nov 13 22:33:11 +0000 2021,"b'It\xe2\x80\x99s me, I\xe2\x80\x99m the starting QB. @ColtMcCoy said I can wear his 12. I\xe2\x80\x99m ready to go fellas \xf0\x9f\xa4\x98\xf0\x9f\x8f\xbd https://t.co/mtAnWRirLk'",it s me i m the starting qb said i can wear his 12 i m ready to go fellas,"Texas, USA","Austin, TX"
Sat Nov 13 22:32:32 +0000 2021,"b'Ignorant, uncaring fools. https://t.co/gO8qr9ShNL'",ignorant uncaring fools,"Mazatlán, Sinaloa","Mazatlán, Sinaloa"
Sat Nov 13 22:32:15 +0000 2021,b'Why do democracies belong to the UN @antonioguterres when there is no balance on a Human Rights council?  Was the U\xe2\x80\xa6 https://t.co/0L8Pb7WrVs',why do democracies belong to the un when there is no balance on a human rights council was the u,Vancouver BC,"Wailea, HI"
Sat Nov 13 22:34:44 +0000 2021,"b'Absolutely\xe2\x80\xa6@Coach_Leach is on record last year with #COVID19 wasn\xe2\x80\x99t even football; he hated it, the worst year of h\xe2\x80\xa6 https://t.co/jeQEAC8lY8'",absolutely is on record last year with wasn t even football he hated it the worst year of h,"Webster Groves, MO","Webster Groves, MO"
Sat Nov 13 22:34:08 +0000 2021,"b'They\xe2\x80\x99ve already started here in Michigan, thankfully https://t.co/d3LhJAvWZl'",they ve already started here in michigan thankfully,Michigan,"Madison Heights, MI"
Sat Nov 13 22:34:23 +0000 2021,"b'Happy 8th anniversary! Thanks to the @CalFootball #COVID19 outbreak, I\xe2\x80\x99m able to attend the party. (at\xe2\x80\xa6 https://t.co/Stuwyz3B0H'",happy 8th anniversary thanks to the outbreak i m able to attend the party at,"Berkeley, CA","Berkeley, CA"
Sat Nov 13 22:34:26 +0000 2021,b'The votes of these ignoramuses count more than my gerrymandered disenfranchised vote. https://t.co/gO8qr9ShNL',the votes of these ignoramuses count more than my gerrymandered disenfranchised vote,"Mazatlán, Sinaloa","Mazatlán, Sinaloa"
Sat Nov 13 22:33:27 +0000 2021,b'Agree with the point of the tweet entirely\n\n20. \n\nStuff of dreams. https://t.co/RrYVfFJ86s',agree with the point of the tweet entirely 20 stuff of dreams,"South East, England","Cheriton, England"
Sat Nov 13 22:35:48 +0000 2021,b'Huh? Literally asking for it to go up https://t.co/539IrHpsaL',huh literally asking for it to go up,"Portsmouth, England","South East, England"
Sat Nov 13 22:36:00 +0000 2021,b'Are y\xe2\x80\x99all fucking stupid \xf0\x9f\x98\x82\xf0\x9f\x98\x82\xf0\x9f\x98\x82 https://t.co/0amgr5vcMG',are y all fucking stupid,,"East Aurora, NY"
Sat Nov 13 22:36:47 +0000 2021,b'Great jersey and so sorry for your loss. May he rest in peace. \xf0\x9f\x99\x8f\xf0\x9f\x8f\xbb https://t.co/9ypunohmTt',great jersey and so sorry for your loss may he rest in peace,,"Elwood, NY"
Sat Nov 13 22:36:24 +0000 2021,"b'Never stop following the money, people! https://t.co/ohPCaXDd9H'",never stop following the money people,Stoke Tydfil,"Stoke-on-Trent, England"
Sat Nov 13 22:38:03 +0000 2021,b'We lost a generation once. https://t.co/nsyRlhlWhG',we lost a generation once,Houston /New York / Europe,"Florida, USA"
Sat Nov 13 22:37:14 +0000 2021,b'@NancyFe28442406 @hooch00011 @MelLittlefeath1 Coronavirus is any virus that causes respiratory in humans &amp; animals.\xe2\x80\xa6 https://t.co/QjTLuX9j6U',coronavirus is any virus that causes respiratory in humans amp animals,"New York, USA","New York, USA"
Sat Nov 13 22:39:48 +0000 2021,b'@glasstorpedoes @FrankLuntz Both of the drugs made in the United States and the United Kingdom have been proved eff\xe2\x80\xa6 https://t.co/jdEZJCzc14',both of the drugs made in the united states and the united kingdom have been proved eff,Pepsi Dream Machine ,"Mannford, OK"
Sat Nov 13 22:40:15 +0000 2021,b'It\xe2\x80\x99s amazing how many people are stupid about how the National Guard works \xf0\x9f\xa4\xa6\xf0\x9f\x8f\xbc\xe2\x80\x8d\xe2\x99\x82\xef\xb8\x8f\n\n@KurtSchlichter https://t.co/oWrz8rRS5S',it s amazing how many people are stupid about how the national guard works,"Madisonville, Louisiana","Mississippi, USA"
Sat Nov 13 22:39:25 +0000 2021,b'First dose done!! \xf0\x9f\x92\xaa\xf0\x9f\x8f\xbb #brave #5yearold #COVID19 #vaccination #CovidVaccine #science https://t.co/k0ZCHOATQB',first dose done,"Brooklyn, NY",Slope Pediatrics
Sat Nov 13 22:40:40 +0000 2021,b'Who cares phoney  and lies https://t.co/I7HtsblXah',who cares phoney and lies,,"Lykovrysi, Greece"
Sat Nov 13 22:42:20 +0000 2021,"b""It's gonna be a very fun Election Year!\n\nLet's be sure to weaponize @JoeBiden's COVID MANDATES for @HouseGOP victor\xe2\x80\xa6 https://t.co/wBz7L3Bjrh""",its gonna be a very fun election year lets be sure to weaponize covid mandates for victor,"Arlington, Virginia","Charlottesville, VA"
Sat Nov 13 22:42:57 +0000 2021,"b""That's Britain off the travel list again https://t.co/sNPrc8Q6cv""",thats britain off the travel list again,"Galway, Ireland","Galway, Ireland"
Sat Nov 13 22:43:07 +0000 2021,b'@Richard70746228 @GrandmaAoc @RSBNetwork Please do not attribute this to Biden. It had nothing to do with him or hi\xe2\x80\xa6 https://t.co/SHJrWZEVBW',please do not attribute this to biden it had nothing to do with him or hi,"Huntington Beach, CA","Huntington Beach, CA"
Sat Nov 13 22:42:22 +0000 2021,b'@AucklandUni so when are you guys gonna fire Thornley for misinformation? https://t.co/f0VijUNK2t',so when are you guys gonna fire thornley for misinformation,"Otara, Auckland","Auckland, New Zealand"
Sat Nov 13 22:42:24 +0000 2021,b'Why March though and not tomorrow. https://t.co/sCGP8w3Z7R',why march though and not tomorrow,Gidi/Oxon,"East Midlands, England"
Sat Nov 13 22:43:37 +0000 2021,b'People can\xe2\x80\x99t remove the microchip out of the covid-19 vaccine after it\xe2\x80\x99s been administered. Due to the fact that it\xe2\x80\x99s not real.',people can t remove the microchip out of the covid 19 vaccine after it s been administered due to the fact that it s not real,"Akron, OH","Akron, OH"
Sat Nov 13 22:44:29 +0000 2021,"b""Long-awaited downtown Hyatt Regency 'comes to life.' Will it be needed when it's completed?\nhttps://t.co/aSSnrg839G\xe2\x80\xa6 https://t.co/kvIZiFgub7""",long awaited downtown hyatt regency comes to life will it be needed when its completed,"Hemet, CA","Valle Vista, CA"
Sat Nov 13 22:44:16 +0000 2021,b'So we should get 97% of the profits as the the major investor or did I miss something https://t.co/lfWSZdopO0',so we should get 97 of the profits as the the major investor or did i miss something,,"Gillingham, England"
Sat Nov 13 22:47:52 +0000 2021,"b""I think they actually hope the Borax will make them whiter. Doesn't work on people, just laundry https://t.co/ZfRCDFFtBN""",i think they actually hope the borax will make them whiter doesnt work on people just laundry,Georgia,"Scottdale, GA"
Sat Nov 13 22:47:25 +0000 2021,b'Warped thinking driven by radical anti-science citizens intent on a selfish path driven solely a political me first\xe2\x80\xa6 https://t.co/OkIxTgxTAK',warped thinking driven by radical anti science citizens intent on a selfish path driven solely a political me first,"New York, USA","Manhattan, NY"
Sat Nov 13 22:51:21 +0000 2021,b'Lpmqlp \xf0\x9f\x98\xad\xf0\x9f\x99\x8f\xe2\x9d\xa4\xef\xb8\x8f https://t.co/WfPXxuj55B',lpmqlp,"Asuncion, Paraguay","Asuncion, Paraguay"
Sat Nov 13 22:50:56 +0000 2021,b'Per Sark:\n-Casey Thompson will start at QB\n-Hudson Card will play\n-Bijan &amp; Roschon expected to play but game-time d\xe2\x80\xa6 https://t.co/zixhCFN35S',per sark casey thompson will start at qb hudson card will play bijan amp roschon expected to play but game time d,"Austin, TX","Austin, TX"
Sat Nov 13 22:52:11 +0000 2021,b'I\xe2\x80\x99ll believe it when I see it https://t.co/F9by2C1rym',i ll believe it when i see it,"North East, England","Gateshead, England"
Sat Nov 13 22:52:10 +0000 2021,b'Thanks for sharing. Awesome learning! https://t.co/fZIIXSSQv7',thanks for sharing awesome learning,"Honiara, Solomon Islands",Indonesia
Sat Nov 13 22:54:29 +0000 2021,b'how does one sue the Federal Government? asking for a colleague\xf0\x9f\xa4\x94\xf0\x9f\xa5\x8a https://t.co/OWSadA5Sac',how does one sue the federal government asking for a colleague,"Dade City, FL","Dade City, FL"
Sat Nov 13 22:54:01 +0000 2021,b'Does the international community still take his pronouncements seriously? Seriously? Meron pa bang nakikinig sa kan\xe2\x80\xa6 https://t.co/D30qKTZheQ',does the international community still take his pronouncements seriously seriously meron pa bang nakikinig sa kan,Puerto Princesa / Manila,"Puerto Princesa City, Mimaropa"
Sat Nov 13 22:55:30 +0000 2021,"b'@DrKellyVictory Right? Severe case 7/2020,treated with Dexa,Azithromycin, antivirals.Dr\xe2\x80\x99s,Nurses said take Zinc,D,\xe2\x80\xa6 https://t.co/Tt9MjuikFw'",right severe case 7 2020 treated with dexa azithromycin antivirals dr s nurses said take zinc d,Richie McPeak,"Forest City, FL"
Sat Nov 13 22:59:55 +0000 2021,"b""Maine has 3rd highest rate of vaccination for total population at 70%. The pandemic isn't over. https://t.co/Y8ViU1uw9x""",maine has 3rd highest rate of vaccination for total population at 70 the pandemic isnt over,"Overland Park, Kansas","Overland Park, KS"
Sat Nov 13 22:58:59 +0000 2021,b'Why do support a PEDOPHILE?\nA child RAPIST?\n\nHOW DO LIVE WITH YOUR SELF...SUPPORTING A CHILD RAPIST....A CHILD RAPI\xe2\x80\xa6 https://t.co/fwAMgmlt4M',why do support a pedophile a child rapist how do live with your self supporting a child rapist a child rapi,"Texas, USA","Garland, TX"
Sat Nov 13 23:01:06 +0000 2021,"b""She's six\nShe's an author\nShe's a humanitarian\nShe's a COVID survivor\nAnd now she's vaccinated.\n#COVID19\n#vaccinated https://t.co/jDaOzM84se""",shes six shes an author shes a humanitarian shes a covid survivor and now shes vaccinated,St. Louis,"Bel-Nor, MO"
Sat Nov 13 23:03:12 +0000 2021,b'Masks work \nK-12 schools without mask mandates in Michigan saw 62% more coronavirus spread https://t.co/S2UtG6HgwS',masks work k 12 schools without mask mandates in michigan saw 62 more coronavirus spread,"Chicago, USA","Oak Lawn, IL"
Sat Nov 13 23:02:24 +0000 2021,b'Hahahahaha...\nWE DONT NEED YOU. OVER\n75% ARE ALREADY VACCINATED.\n\nNEVER FORGET MARSHA SUPPORTS A CHILD RAPIST. https://t.co/1IJoaZzjRT',hahahahaha we dont need you over 75 are already vaccinated never forget marsha supports a child rapist,"Texas, USA","Garland, TX"
Sat Nov 13 23:02:49 +0000 2021,b'Rocking #11 today \xf0\x9f\xa4\x98\xf0\x9f\x8f\xbd Let\xe2\x80\x99s get it Casey https://t.co/2p9dvm0QRo https://t.co/P9gb8J9BZ4',rocking today let s get it casey,"Texas, USA","Austin, TX"
Sat Nov 13 23:03:34 +0000 2021,"b'Wonder when YOU can get the #COVID19 booster (if like me, you got AZx2): probably right now. Our friend and neighbo\xe2\x80\xa6 https://t.co/TL9WNkazrt'",wonder when you can get the booster if like me you got azx2 probably right now our friend and neighbo,Toronto🇨🇦🇮🇹 🇮🇪,"Toronto, Ontario"
Sat Nov 13 23:04:38 +0000 2021,b'This regime preys on fear and so many people are afraid. You can tell from their anger and lack of reasoning. Get o\xe2\x80\xa6 https://t.co/F2iIR8Vbt4',this regime preys on fear and so many people are afraid you can tell from their anger and lack of reasoning get o,Richie McPeak,"Forest City, FL"
Sat Nov 13 23:07:16 +0000 2021,b'I dunno. Maybe get vaccinated? https://t.co/FkRiMYtU76',i dunno maybe get vaccinated,"Spokane, Wash.","Lihue, HI"
Sat Nov 13 23:06:32 +0000 2021,b'@DeanAllisonMP my Mom and sister are voters in your riding.   \xe2\x80\x9cIvermectin\xe2\x80\x9d is NOT a cure for COVID-19',my mom and sister are voters in your riding ivermectin is not a cure for covid 19,"St Catharines, Ontario","St. Catharines, Ontario"
Sat Nov 13 23:09:07 +0000 2021,"b'It\'s kind of a relief nature\'s doing it\'s ""natural selection"" job.  I feel a little bit safer knowing we\'re safer w\xe2\x80\xa6 https://t.co/TUpLwCu1mK'",its kind of a relief natures doing its natural selection job i feel a little bit safer knowing were safer w,East Coast,"Pennsylvania, USA"
Sat Nov 13 23:08:28 +0000 2021,"b'I\xe2\x80\x99m such a failure \xe2\x80\xa6. \n\nCOVID-19 Test Result:\n\nThomas is NEGATIVE for COVID-19 based on the test taken on Nov 12, 2\xe2\x80\xa6 https://t.co/LDIYkWo2vY'",i m such a failure covid 19 test result thomas is negative for covid 19 based on the test taken on nov 12 2,"Calgary, Alberta; Canada","Calgary, Alberta"
Sat Nov 13 23:07:38 +0000 2021,"b'@kylenabecker Yes.Severe case 7/2020,treated with Dexa,Azithromycin, antivirals.Dr\xe2\x80\x99s, Nurses said take Zinc,D, C, w\xe2\x80\xa6 https://t.co/4xhvYwSTIW'",yes severe case 7 2020 treated with dexa azithromycin antivirals dr s nurses said take zinc d c w,Richie McPeak,"Forest City, FL"
Sat Nov 13 23:10:32 +0000 2021,"b'Rodgers ready to duel Wilson, Seahawks after stint on COVID-19 list\nhttps://t.co/icpIMj29UK'",rodgers ready to duel wilson seahawks after stint on covid 19 list,"Philadelphia, PA","Philadelphia, PA"
Sat Nov 13 23:12:01 +0000 2021,"b'Straight communities, get your houses in order. We can\xe2\x80\x99t carry you through this pandemic. #COVID19 #GetVaccinated https://t.co/ccMo8nNaVI'",straight communities get your houses in order we can t carry you through this pandemic,Arizona,"Tucson, AZ"
Sat Nov 13 23:12:15 +0000 2021,"b'@JoDavis95211724 @ReddingtonAlice Try following doctors on Twitter, eg. https://t.co/uyysp2lkku'",try following doctors on twitter eg,"Devon, UK","South West, England"
Sat Nov 13 23:16:22 +0000 2021,b'Fairly close to previous reports showing increased vaccination rates in the LGBTQ+ community. https://t.co/ds25Pwnfem',fairly close to previous reports showing increased vaccination rates in the lgbtq community,Arizona,"Tucson, AZ"
Sat Nov 13 23:18:19 +0000 2021,"b'Play dumb games, win stupid prices. https://t.co/ruYlWHB6Wa'",play dumb games win stupid prices,,"Reynosa, Tamaulipas"
Sat Nov 13 23:24:06 +0000 2021,"b'""The Trump administration repeatedly interfered with efforts by the CDC last year to issue warnings and guidance ab\xe2\x80\xa6 https://t.co/4f7cEcUREA'",the trump administration repeatedly interfered with efforts by the cdc last year to issue warnings and guidance ab,"Baltimore, MD","Owings Mills, MD"
Sat Nov 13 23:26:01 +0000 2021,"b'At @thewarehousenz in Masterton and waiting in line, not done that in a while #COVID19'",at in masterton and waiting in line not done that in a while,"Masterton District, New Zealan","Masterton District, New Zealand"
Sat Nov 13 23:25:18 +0000 2021,b'If the winter is about to cause hundreds of thousands of more patients for @nhs due to flu and covid surely you sho\xe2\x80\xa6 https://t.co/dcAtcBikSq',if the winter is about to cause hundreds of thousands of more patients for due to flu and covid surely you sho,"London, England","Lewisham, London"
Sat Nov 13 23:25:41 +0000 2021,b'@hornchurchammer @frankum_ian @DOWHU_1995 @MarshyBoy26 @charlieflorey 1/3 Now it has been confirmed that new Covid-\xe2\x80\xa6 https://t.co/ktDO20TJ1P',1 3 now it has been confirmed that new covid,Could literally be anywhere🌍 ,"Doddinghurst, East"
Sat Nov 13 23:28:31 +0000 2021,b'CDC: No Record of Naturally Immune Transmitting COVID-19 https://t.co/6WcP7CKPnF\n \nDownload our app to read more at https://t.co/fe3W16LZjq',cdc no record of naturally immune transmitting covid 19 download our app to read more at,,"Lady Lake, FL"
Sat Nov 13 23:28:19 +0000 2021,"b'""White House adviser Scott Atlas worked to curtail access to coronavirus tests last year. According to Birx, Atlas\xe2\x80\xa6 https://t.co/HhlZo97pRK'",white house adviser scott atlas worked to curtail access to coronavirus tests last year according to birx atlas,"Baltimore, MD","Owings Mills, MD"
Sat Nov 13 23:31:26 +0000 2021,b'Right! Dka https://t.co/PplB9acA1q',right dka,,"Makindu, Kenya"
Sat Nov 13 23:31:16 +0000 2021,b'@wearynomad1 @normanswan Yep..recently retired RN (Family) informed us her registration is being paid for by\xe2\x80\xa6 https://t.co/tC5tlrp6Km',yep recently retired rn family informed us her registration is being paid for by,"Adelaide, SA (Kaurna Land)","Adelaide, South Australia"
Sat Nov 13 23:30:20 +0000 2021,b'@DrTomFrieden Tell me this have you ever seen a virus mutate so quickly as COVID19 virus has since it was identified in December of 2019.',tell me this have you ever seen a virus mutate so quickly as covid19 virus has since it was identified in december of 2019,"Georgia, USA","Georgia, USA"
Sat Nov 13 23:33:23 +0000 2021,b'The Cop say don\xe2\x80\x99t play smart \xe2\x80\xa6. https://t.co/2M5onxyhql',the cop say don t play smart,"Nassau, The Bahamas",Bahamas
Sat Nov 13 23:34:16 +0000 2021,"b""OSHA has no say in the vaccines its not there job and they can be fired in your state buy your Governor!! They can'\xe2\x80\xa6 https://t.co/sgrLhIhlP4""",osha has no say in the vaccines its not there job and they can be fired in your state buy your governor they can,"Florida, USA","Clermont, FL"
Sat Nov 13 23:34:55 +0000 2021,b'THIS POS BELONGS IN PRISON HE IS A CORRUPT POS https://t.co/8KwduDCB1S',this pos belongs in prison he is a corrupt pos,"Florida, USA","Clermont, FL"
Sat Nov 13 23:35:01 +0000 2021,b'this is stupid https://t.co/L0qWe2WV4b',this is stupid,Sheffield/Liverpool,"Liverpool, England"
Sat Nov 13 23:33:36 +0000 2021,b'@RaRaBin2 @chrisvanderveen This seems to be right in line.\n\nhttps://t.co/PIYwbBIqKG',this seems to be right in line,,"Colorado, USA"
Sat Nov 13 23:35:51 +0000 2021,"b'Not there yet, \xf0\x9f\x87\xa8\xf0\x9f\x87\xa6. Please #GetVaccinated. \xf0\x9f\x92\x89 https://t.co/dBw8ZOAUUC'",not there yet please,"Cape Breton, or wishing I were","Ottawa, Ontario"
Sat Nov 13 23:39:52 +0000 2021,"b'@Kellie_Tallant Perfectly healthy. But have type one diabetes and haemochromatosis, underlying illness but no life\xe2\x80\xa6 https://t.co/MrEMCevajm'",perfectly healthy but have type one diabetes and haemochromatosis underlying illness but no life,Salford ,"Salford, England"
Sat Nov 13 23:40:36 +0000 2021,b'@karamballes https://t.co/308jh2pIgs. Cambridge Analytics meets US evangelicals. Interesting in relation to this:\nW\xe2\x80\xa6 https://t.co/lTOd2pQu9k',cambridge analytics meets us evangelicals interesting in relation to this w,"Oxford, England","Marsh Baldon, England"
Sat Nov 13 23:41:37 +0000 2021,"b'@AishaYesufu @Squadrondavid Same thing we did @Miraclegeraldin, ours was during #COVID19 tho.'",same thing we did ours was during tho,Mars ,"Federal Capital Territory, Nigeria"
Sat Nov 13 23:44:20 +0000 2021,b'@JenBenPowers We do book character dress up day as well and I bought a Star Trek the next generation one of these a\xe2\x80\xa6 https://t.co/HrFTX6zIW5',we do book character dress up day as well and i bought a star trek the next generation one of these a,"Elkins, AR","Elkins, AR"
Sat Nov 13 23:43:10 +0000 2021,"b'But, sure, we can trust the numbers. https://t.co/aGDhxk1BtW'",but sure we can trust the numbers,,"Traverse City, MI"
Sat Nov 13 23:44:12 +0000 2021,"b'Survivors, not experiments! https://t.co/Nvu7yrPTGk'",survivors not experiments,Guam,"Afame, GU"
Sat Nov 13 23:45:27 +0000 2021,"b'Despite the fact that India did a great job in fighting #COVID19, this stupid bastard cartoonist @anoopamartya dare\xe2\x80\xa6 https://t.co/oqI3DT7OEq'",despite the fact that india did a great job in fighting this stupid bastard cartoonist dare,"New York, USA","Greenville, NY"
Sat Nov 13 23:47:08 +0000 2021,b'Get vaccinated. This isn\xe2\x80\x99t hard. https://t.co/gixo1O637B',get vaccinated this isn t hard,"Toronto, Canada","Whitby, Ontario"
Sat Nov 13 23:47:59 +0000 2021,b'Thank you all for your immense support in the Black Community Wellness Hub event \nWell. More than 70 residents part\xe2\x80\xa6 https://t.co/5b1zt2zX0q',thank you all for your immense support in the black community wellness hub event well more than 70 residents part,"Toronto, Ontario","Toronto, Ontario"
Sat Nov 13 23:54:42 +0000 2021,b'This is a scandal that must stop now. @MinPres @hugodejonge https://t.co/d96QPCPnNo',this is a scandal that must stop now,Utrecht,"Utrecht, The Netherlands"
Sat Nov 13 23:55:33 +0000 2021,b'@fordnation @C_Mulroney @PBethlenfalvy #VoteFordOut2022 \xf0\x9f\xa4\xa1\n#ConservativeParty \nAlways\n#ConParty \n\n#Duck\xf0\x9f\xa6\x86 Oops #Doug\xe2\x80\xa6 https://t.co/GJGXpUyYWv',always oops,Toronto Ontario Canada,"Toronto, Ontario"
Sat Nov 13 23:55:36 +0000 2021,"b'@RepThomasMassie Floridian.Severe case 7/2020,treated with Dexa,Azithromycin, antivirals.Dr\xe2\x80\x99s,Nurses said take Zinc\xe2\x80\xa6 https://t.co/yOYpV231Oc'",floridian severe case 7 2020 treated with dexa azithromycin antivirals dr s nurses said take zinc,Richie McPeak,"Forest City, FL"
Sat Nov 13 23:58:16 +0000 2021,b'Cleveland Orchestra cancels Saturday\xe2\x80\x99s concert due to musician possibly having coronavirus https://t.co/ApW8UxhJXX',cleveland orchestra cancels saturday s concert due to musician possibly having coronavirus,"Columbus, Ohio","Powell, OH"
Sat Nov 13 23:59:24 +0000 2021,b'Agreed https://t.co/64FExk15l9',agreed,"San Francisco, CA","Fremont, CA"
Sun Nov 14 00:02:21 +0000 2021,b'Experts in Singapore have said all the signs are Australia will see a similar surge in cases. Full story:\xe2\x80\xa6 https://t.co/NkuYm7HKx3',experts in singapore have said all the signs are australia will see a similar surge in cases full story,Sydney Australia,"Sydney, New South Wales"
Sun Nov 14 00:02:55 +0000 2021,b'This!! \xf0\x9f\x91\x87 (and wear a mask) https://t.co/2P6XJ4ahXb',this and wear a mask,"Plymouth, England","Plymouth, England"
Sun Nov 14 00:05:53 +0000 2021,b'Only stoping germs in the ground from growing in the food Deer eatI found this on NewsBreak \xe2\x80\x93 the #1 local news app\xe2\x80\xa6 https://t.co/6ySMa6oU48',only stoping germs in the ground from growing in the food deer eati found this on newsbreak the local news app,"Marion, SC","Marion, SC"
Sun Nov 14 00:08:26 +0000 2021,"b""Y'all Okies ain't qualified to be deployed anymore. That's all you Mofos. Enjoy that Big Chicken Dinner, Boys https://t.co/q6JoVqxryY""",yall okies aint qualified to be deployed anymore thats all you mofos enjoy that big chicken dinner boys,Haverhill MA,"Haverhill, MA"
Sun Nov 14 00:08:38 +0000 2021,"b""One man's courage is an example to business leaders everywhere. \n\nhttps://t.co/nzoSvouygF""",one mans courage is an example to business leaders everywhere,Auckland,"Auckland, New Zealand"
Sun Nov 14 00:10:44 +0000 2021,b'Catch me wearing my mask all the way to my car just to keep my face warm. #Winter #COVID19 #Mask',catch me wearing my mask all the way to my car just to keep my face warm,"Wisconsin, USA","Wisconsin, USA"
Sun Nov 14 00:14:31 +0000 2021,b'.@DMRegister/@JASelzer Iowa Poll:\n\nDo you approve or disapprove of the way Joe Biden is handling\xe2\x80\xa6?\n\n% Approve/Disap\xe2\x80\xa6 https://t.co/WfaoCFfnXa',iowa poll do you approve or disapprove of the way joe biden is handling approve disap,"Miami Beach, Florida","Bay Harbor Islands, FL"
Sun Nov 14 00:18:00 +0000 2021,"b'So strange that a vaccine that ""protects"" you from Covid-19 does not protect you from the unvaccinated'",so strange that a vaccine that protects you from covid 19 does not protect you from the unvaccinated,"Allentown, PA","Pennsylvania, USA"
